,text,score,jaehyeong/koelectra-base-v3-generalized-sentiment-analysis,klue/bert-base,matthewburke/korean_sentiment,monologg/koelectra-base-v2-discriminator,skt/kogpt2-base-v2,beomi/kcbert-large
1322,"다양한 수업 사례를 볼수 있어서 유익했던 연수 15교육과정의 특징과 그에 맞는 수업을 구현하기 위한 방법론을 터득할 수 있었습니다.

각 단원의 특징과 그에 맞는 학습자 중심의 수업을 구현하기 위해 꼭 필요한 연수였습니다.

학습 이후에도 계속 찾아서 복습하면서 현장에서 적용하기 위해 노력할 것입니다.",1,1,0,1,0,0,0
1323,유익한 연수였습니다. 이번 연수를 통해 칼림바를 처음 만져봤는데 초보자도 차근차근 따라할 수 있는 재미있는 연수였습니다. 교재와 칼림바까지 제공되어 정말 알찬 시간을 보낼 수 있었습니다. 감사합니다.,1,1,0,1,0,0,0
1324,많은 도움이 되었어요 차분한 설명으로많은 도움이 되네요,1,1,0,1,0,0,0
1325,정말 도움이 많이 되었습니다♡ 발령을 받고 올해 처음으로 담임을 맡게 되었습니다. 처음 아이들을 맡는 설렘과 기대감이 있는 동시에 1년을 어떻게 꾸려 나갈지에 대한 막막함과 걱정이 있었습니다. 하지만 이 연수를 듣고 나서 머릿속으로 큰 틀이 그려지고 무엇을 준비해야하는지 알게 되었습니다! 선배 선생님들의 노하우를 배울 수 있었고 생생한 경험들을 토대로 강의를 해주셔서 공감이 많이 되었습니다! 그리고 당장 교실에서 따라 할 수 있도록 세세하고 구체적으로 알려주셔서 좋았습니다~ 저도 올해 맡게될 아이들과 즐겁고 행복한 1년을 만들겠다고 다짐하게 되었습니다ㅎㅎ좋은 강의 감사드립니다~!,1,1,0,1,0,0,-1
1326,잘봤습니다. 디테일하고 자세해서 좋았습니다.,1,1,0,1,0,0,0
1327,"좋았어용 ~ 덕분에 상식도 넓히고 건강을 잘지킬 수 있게 된 것 같아요
고맙습니다~
새해복많이 받으세용~",1,1,0,1,0,0,0
1328,"좋았어용 ~ 도움 많이 되었습니다
새해 복 많이 받으세용",1,1,0,1,0,0,0
1329,"대학 교양수업에서 과학철학사 듣던 시절이 기억나는 강의였습니다. 유익하고 재미있는 강의 잘 들었습니다.
대학 교양수업에서 과학철학사 듣던 시절이 기억나는 강의였습니다.
다만 과학적 기본지식이 없는 경우 어렵게 느껴질 수 는 있을 것 같습니다.
한 가지 안타까운 것은 강의 속 자막에 오타가 많고 아무 지식없는 사람이 받아쓰기를 한 것 같은 점이 아쉽습니다.",1,1,0,1,0,0,0
1330,좋은 강의 감사합니다. 좋은 강의 감사합니다.,1,1,0,1,0,0,0
1331,"구국계몽운동 연수 듣기 전에는 독립운동에 대해 잘 알지 못 했습니다
독립운동을 하셨기에 독립한 나라에서 자유롭게 살 수 있는 것 같아서 학생들에게 왜 독립운동을 해야 하는지 우리가 그 분들을 왜 기억해야 하는지에 대해서 좀 더 정서적으로 합리적인 이유를 들어서 수업을 진행할 수 있게 준비할 수 있도록 도움이 되어서 방학 동안 연수를 들은 것에 대해 스스로 만족감기 높았습니다.",1,1,0,1,0,0,0
1332,"나라 사랑하는 마음을 다져보는 연수 시간에 감사합니다. 의병 활동에 감사하며 우리 고장 및 인근에 있는 의병 관련 장소를 찾아봐야겠다는 생각을 해본다.

할머니 할아버지가 전해주시는 옛 이야기처럼 역사가 지루하지 않게 느껴져서 인터뷰 형식으로 이야기를 듣는 방식의 연수 진행이 좋았다.

역사 전공이 아니지만, 애정을 가지고 복습할 만한 연수를 무료 개설해주셔서 T셀파 연수원에 감사합니다.",1,1,0,1,0,0,0
1333,"독립을 위해 희생하셨던 많은 분들에 대해 알게 된 유익한 연수였습니다. 연수 내용 자체는 좋았지만, 사진 등의 시각적 자료보다 설명방식으로만 진행된 점이 아쉽습니다.",0,1,0,1,0,0,0
1334,"다양한 놀이로 풀어보는 교과 공부시간 여러 선생님들이 나와서 자신만의 수업 노하우를 알려주는 실제적 도움이 되는 연수였습니다. 교재를 보면서 수업을 듣고 그것을 실제로 저의 수업에 적용해 보니, 더욱 더 살아있는 연수 체험이 되었던 것 같습니다.
공개 수업에도 도움을 받을 수 있는 꿀팁이 많은 수업 도우미 연수였습니다. 여러 선생님들도 한번씩 다들 들어보시면 좋겠습니다.^^",1,1,0,1,0,0,0
1335,핵심만 짚어주는 리얼 꿀팁! 같은 방식의 쌍방향 수업에 저역시도 매너리즘에 빠져 있는데 친근한 옆반샘이 알려주는 방식으로 중요하면서도 효과적인 쌍방향 실시간 수업 방법을 알려주셔서 정말 도움이 많이 되었어요. 쌍방향 원격 수업에 효과적인 방법을 찾고 계신 선생님들이라면 정말 도움을 많이 받으실 것 같습니다. 수업 잘 들었습니다.^^,1,1,0,1,0,0,0
1336,"영어문법의 기본 중의 기본 학창시절에 문법을 좀 공부하고 손 놓고 있다가 옛 책을 이용해 다시 공부를 해보았는데도 고전은 고전인지라 전혀 불편함 없이 술술 공부가 잘 되었어요. 강사선생님의 설명도 이해가 쏙쏙 되었고, 영어공부의 가장 기초가 되는 문법이 다시 탄탄하게 잡힌 느낌입니다.
영어 공부를 좀 더 단단하게 기초를 잡으면서 실용회화나 시험준비를 하시는 선생님들께 큰 도움이 될 것 같습니다. 저도 그랬으니까요.^^",1,1,0,1,0,0,0
1337,"나의 귀를 쉽게 더 열어줄 리스닝! 두 진행자의 정확한 발음으로 듣는 실상에 쓰이는 회화도 그렇고 우리 문화재를 소개하는 내용도 그렇고 여러모로 귀가 트이는 데에 큰 도움을 받은 연수입니다. 자막도 나와서 귀로 듣고 눈으로 읽으니 청취 연습에 더 큰 도움이 되고, 영어적 표현을 더 연습할 수 있어서 좋았습니다. 영어 청취가 약하셔서 연습을 원하는 선생님들께 추천!!!^^",1,1,0,1,0,0,0
1338,"고맙습니다~ 넘나 재미나게 들었어요 많이 많이 도움되었습니다.
항상 건강하시고 앞으로도 좋은 연수 많이 많이 부탁드려요
새해복 많이 받으셔용",1,1,0,1,0,0,0
1339,"편안하게 들을 수 있는 철학 이야기 막연히 멀게, 어렵게 느껴지던 연수를 좀 더 가깝게 느낄 수 있는 시간이었습니다.
다양한 철학자들의 이론을 짧은 시간에 개괄적으로 살펴볼 수 있어 좋았는데, 다음에 한 명 한 명 조금 더 공부해가며 다시 듣고 싶은 연수입니다.",1,1,0,1,0,0,0
1340,"감사합니다^^ 넘나 재미나게 들었어요 많이 많이 도움되었습니다.
항상 건강하시고 앞으로도 좋은 연수 많이 많이 부탁드려요
새해복 많이 받으셔용",1,1,0,1,0,0,0
1341,연수가 좋습니다. 방학을 이용하여 이런 좋은 내용의 연수를 듣게되어 너무 좋습니다. 수학교과서에 대해 다시한번더 생각해보는 기회가 되었습니다.,1,1,0,1,0,0,0
1342,많은 도움 감사합니다. 학교 현장에서 정말 유용한 정보들을 알려주셔서 의미있는 연수였습니다. 감사합니다.,1,1,0,1,0,0,0
1343,연수가 좋네요 연수의 내용이 전반적으로 새로운 교과서에 대해 잘 알려주고 5차시라 부담감이 없어 좋습니다. 궁금했는데 궁금증이 다소 해결되었습니다.,1,1,0,1,0,0,0
1344,연수가 실질적이다 연수가 실질적이라서 도움이 많이 되겠습니다. 의무적으로 들었던 연수를 총정리하는 기회도 되었습니다. 겨울방학때 시간날때 들으니까 더욱 좋습니다.,1,1,0,1,0,0,0
1345,막막한 원격수업 막막한 원격수업에 꼭 필요한 연수였습니다.,1,0,0,1,0,0,0
1346,말그대로 한번에 끝낼 수 있어 굿! 필수적으로 들어야 하는 법정 연수를 한번에 끝낼 수 있어서 만족스럽습니다.,1,1,0,1,0,0,0
1347,"긍정적인 생활은 암도 완치될 수 있다. 다양한 분야의 전문의학 강좌를 통해서 건강을 돌아볼 수 있는 계기를 주셔서 감사합니다. 쉽게 접할 수 없는 전문적인 내용을 연수를 통해서 알게 되어 정말 유익했습니다. 특히 유방암 관련 내용에서는 자가진단의 필요성과 긍정적인 자세를 많이 강조 하셨는데 많은 공감이 가는 내용이었습니다. 친정어머니께서는 78세에 3기 유방암 절제 수술을 하시고 완치되셨습니다. 올해 92세가 되셨는데도 각종 작물들과 대화를 나누며 농삿일을 즐겁게 하십니다. 저희 엄마의 암극복의 비법은 긍정과 감사, 일하는 즐거움에 있었던거 같습니다.",1,1,0,1,0,0,0
1348,"독립운동가들의 숭고한 정신 잊지 않겠습니다. 조국의 고난과 시련 속에서 조국의 독립을 위하여 자신을 바쳐 치열하게 살다 가신 독립운동가들의 숭고한 정신을 잊지 않을 것이며, 우리 학생들에게도 전달하고 지도하겠습니다.
알찬 연수 감사합니다.",1,1,0,1,0,0,0
1349,독립운동 그 현장에 대해서 더 깊이 독립운동의 현장을 더욱 자세히 알게 되는 값진 경험이었습니다.,1,1,0,1,0,0,0
1350,"잘 들었습니다.! 긍정적인 마음이야말로
자신을 발전시킬 수 있는 근본적인 마음
자존감과 밀접한 연관이 있을 수 밖에 없다는 생각이 들었습니다.!

감사합니다~",1,1,0,1,0,0,0
1351,정말 좋은 연수였어요. 고등학생은 물론 중학생 지도에도 도움이 될 듯 합니다.,1,1,0,1,0,0,0
1352,유익했습니다! 짧지만 유익했습니다!,1,1,0,1,0,0,0
1353,독서수업방법에 대한 A~Z까지 초등 저학년을 맡게 되면서 그림동화책에 많은 관심을 가지게 되었고 이 연수를 신청하게 되었습니다. 이 연수는 독서와 관련하여 유명하신 여러 분들을 초대해 인터뷰하는 식으로 되어 있어 독서수업방법에 대한 A부터 Z까지를 총망라해 놓은 느낌이었습니다. 진행하시는 김성현 선생님은 다양한 스펙트럼을 다 소화하시는 분이라 역시 진행을 편안하고 깔끔하게 잘 하십니다.,1,1,0,1,0,0,0
1354,"짧은 시간 안에 쉽게 배울 수 있어 좋았습니다. 강의 수가 많지 않아 부담 없이 들을 수 있었습니다.
좋은 연수 감사합니다.",1,1,0,1,0,0,0
1355,좋은 연수 좋은 연수,1,1,0,1,0,-1,0
1356,쉽게 배울 수 있었어요. 자칫 어렵고 다루기 힘든 내용을 쉽고 두 분이 대화하면서 알려 주셔서 재미있게 배울 수 있었어요. 고맙습니다.,1,1,0,1,0,0,0
1357,유익한 연수였습니다. 나이 들면서 가장 관심이 가는 것이 건강인데.. 유익한 정보들을 쉽게 잘 설명해 주셨습니다. 감사합니다.,1,1,0,1,0,0,0
1358,정말 좋네요! 효율적으로 꼭 필요한 연수를 들을 수 있었습니다.,1,1,0,1,0,0,0
1359,"알차고 재미있는 연숭 평소 그림에 자신이 없고 어려워한 편이었는데,
최근 온라인 학습 등으로 컨텐츠 활용이 많아져서
저작권의 문제로 고민이 많았습니다.
본 연수를 통해 배우고, 연습해 본 것들을 잘 활용해서
학급 운영 및 학습 자료 제작, 콘텐츠 제작 등에 필요한
기초적인 자료를 스스로 제작하고 활용할 수 있을 것 같습니다.
감사합니다.",1,1,0,1,0,0,0
1360,기초 과학에 대한 중요성 학생들과 영재 수업을 4년째 하고 있습니다. 아이들에게 과학 지식 뿐만 아니라 과학과 관련된 재미있는 이야기들을 해줄수 있게 되었습니다.,1,1,0,1,0,0,0
1361,잘 들었습니다. 감사합니다.,1,1,0,1,0,0,0
1362,오~! 좋아요~ 파워포인트라 접근성도 좋고 쉽고 간편하게 처리 할 수 있어서 좋습니다.,1,1,0,1,0,0,0
1363,"정말 추천해요~ 담임 경력이 짧은데 내년 학년 아직 결정도 안 된 상태에서 내년 걱정만으로 겨울방학이 편하지 않았는데...
봄방학 때 정신없어서 미리 학급경영 준비하고자 할 때 딱! 있어서 너무 좋았어요.
제목 그대로 정말 당장 따라 할 수 있는 실질적인 내용과 다양한 팁들이 있어서 내년 어느 학년을 맡아도 자신감 있게 따라 해 볼 수 있을 것 같아 너무 좋았고요.
이제까지는 클릭 연수도 많았지만 정말 하나 하나 열심히 들었어요!
꼭 내년에 실천해 볼 생각입니다!!!
꼭 신규 뿐만 아니라 옆반 선생님 학급경영 보듯 자세히 알 수 있어서 정말 좋았고 강추합니다!
좋은 연수 정말 감사했습니다~",1,1,0,1,0,0,0
1364,한번에 끝내는 법정연수 1 유익한 연수였습니다. 잘 들었습니다.,1,1,0,1,0,0,0
1365,강사분이 적극적으로 자세히 설명하는 부분이 너무 좋음 강사분이 적극적으로 자세히 설명하는 부분이 너무 좋음,1,1,0,1,0,0,0
1366,"계기교육 및 사회 교육에 도움되어요~! 저도 학창 시절에 배웠다가 잊고 있었던 역사에 대해서 생생하게 배울 수 있었고, 학생들에게도 창체 계기교육이나 사회과 역사 교육에 풍부한 자료들을 활용하면 좋을 것 같아요! 강좌 추천합니다~^^",1,1,0,1,0,0,0
1367,"나라에 대한 사랑과 나의 삶을 돌아보게 하는 인상적인 수업 독립운동이라고 하면 유명한 사건과 인물을 중심으로 기억하고 있지만 그 분들외 더 많은 분들이 계셨다는 것과 그분들의 희생으로 우리가 행복하게 살아가고 있다는 것을 다시 한 번 느끼게 되는 연수이다.
세부적인 내용을 잘 알지 못했던 내가 조금은 부끄럽게 느껴지기도 했고 역사적인 사건을 조금 더 자세하게 알게되고 생각하게 되는 수업이다.",1,1,0,1,0,0,0
1368,손그림 그리기 알찬연수입니다,1,1,0,1,0,0,0
1369,"[만족후기]초등 국어 온작품 읽기는 여기에서 클리어하세요! 초등 국어에서 제일 많은 고민되는 부분이 온작품 읽이였어요. 사실 어떤 책을 골라야할까, 수많은 작품들을 제가 혼자 읽을 수 없는데 고민이 많았었지요. 더불어 그림책을 좋아하는터라, 아이들과 그림책을 활용해서 좀 깊이있는 수업을 하고 싶은데 어떻게 해야할지 참으로 막막했는데 연수를 통해서 다양한 선생님들의 그림책 활용법에 대해 알게되서 좋았고, 또한 그림책들을 실제 사용한 수업사례를 볼 수 있어 좋았습니다. 내년에 새로 맡게될 아이들과 당장 사용해보려고 합니다! 그림을 활용해서 깊이있는 수업 어렵지 않아요. 초등 국어 온작품 읽기는 이 연수로 클리어 하세요!!!^^롸잇나우!",1,1,0,1,0,0,0
1370,우리가 알아야 할 기후변화 꼭 알아야 하지만 항상 뒷전으로 밀려나는 기후변화에 대해 알게 될 수 있는 좋은기회,1,1,0,1,0,-1,0
1371,"우리의 미래 기후에 달려있다. 내년부터 시행되는 기후위기 탄소중립 생태환경교육이 전체적으로 시행되는것으로 알고 있습니다. 이에 아이들을 위해 생태환경교육을 준비하기 위해 ""기후변화 이야기"" 연수를 들었는데요, 강사님이 과학이야기 작가이시다 보니 편안하고 재미있게 기상과 관련된 지구과학 이야기를 쉽게 풀어주시는 걸 듣고 있으니 머리에 쏙쏙 들어오고 참 재미있었습니다. 기후위기, 환경파괴 이런것들을 어렸을 때부터 들어는 왔지만, 막상 이렇게 눈앞에 지구의 생명들에 위기가 바로 다가오니 더 이상은 방관하거나 모른체할 수 없는 상황입니다. 우리아이들의 미래를 위해 이제 실천해야할 때인 것 같습니다. 연수를 통해 위기의기를 느끼고 우리들이 뭔가 해야 한다는 의식을 고취시키기에 좋은 연수입니다.",1,1,0,1,0,0,0
1372,연수 잘 들었습니다. 연수 잘 들었습니다.,1,1,0,0,0,0,0
1373,"좋은 연수 잘 들었습니다. 신병주 교수님의 차분한 강의로 조선시대 왕을 통해 역사와 문화을 배울 수 있는 시간이었습니다.
좋은 연수 감사합니다.",1,1,0,1,0,0,0
1374,공감합니다 공감되는 부분이 많아서 감사합니다.,1,1,0,1,0,0,0
1375,기본에 충실한 꿀팁 가득한 강의 요즘 아이들이 많이 사용하는 sns를 활용한 다양한 수업 방법을 제시해주어 실제 수업에 바로 적용 가능한 부분들이 많은 강의입니다! 코로나로 원격수업을 진행하는 학교가 많은데 여러 선생님들께 간단하면서도 쉽게 따라할 수 있도록 수업의 방향을 제시해주는 강의라고 생각되어 추천합니다!,1,1,0,1,0,0,0
1376,매우 잘 들었습니다 감사합니다 땡큐베리마치,1,1,0,1,0,0,0
1377,"보람찬 연수! 역사를 가르치면서도 잊고지내던 위인들에 대한 감사함을 다시 한번 느낀 연수였습니다.

감사합니다.",1,1,0,1,0,0,0
1378,오~ 듣기 실력 향상에 큰 도움이 되었습니다. 흥미로운 국내 유적지와 유물으등의 문화유산을 소개하며 두 진행자가 재미있게 진행해 주셨습니다. 개인적으로 연수를 늦게 신청하여 연수 기간이 짧았지만 다시 듣고 싶을만큼 현실적으로 도움이 되며 내용도 좋았습니다. 교과서에 박힌 과거형 자료가 아닌 실제적이며 원어민과 활용하기 좋은 표현들이었습니다. 우리 나라를 외국인에게 소개하기에도 적합하며 해당 유적지를 방문할 때 어떤 시각을 가지고 가면 좋은지 생각해 보게 되었습니다. 영어 수업에도 아이들에게 조금씩 우리 문화 소개부분을 다뤄봐야겠습니다^^ 감사합니다.,1,1,0,1,0,0,0
1379,"내년에도 저학년을 하는데 도움이 될 것 같아요 아이들의 심리를 점점 모르는 경우가 많아지더라구요
내년에는 잘 듣고 활용해봐야겠어요",1,1,0,1,0,0,0
1380,바로 써먹을 수 있는 놀이 레시피 실제 적용할 수 있는 놀이로 교과 및 상담등 학생 생활전반에 걸쳐 활용할 수 있는 놀이수업이다,1,1,0,1,0,0,0
1381,"너무 잘들었어요 효율적으로 한번에 다 들을 수 있는 점과
뭔가 토크쇼 같이 편안하게 강의해주셔서 귀에 쏙쏙 들렸습니다.",1,1,0,1,0,0,0
1382,좋은 강의 감사합니다~ 좋은 강의 감사합니다~,1,1,0,1,0,0,0
1383,"유익한 강의 감사합니다. 우리 나라 곳곳에 숨겨진 문화유산에 가치를 새롭게 깨닫는 기회가 되었습니다.
우리 나라에 대한 자부심과 자긍심을 가지게 되었습니다.",1,1,0,1,0,0,0
1384,"애들이 이해가 안 가서 화가 난 거였어요. '애들이 대체 왜 저러지? 이번 학년 최악이다. 말이 안 통한다.'고만 생각을 했어요. 그런데 제가 아이들을 이해 못하고, 잘못된 행동만 하고 있었군요ㅋㅋㅋㅠㅠ 강사 선생님들께서 말씀하시는 '하면 안되는'행동들을 다 제가 하고 있었어요... 이 연수를 1학기에 봤으면 더 좋았을 것 같아요. 미안하다 얘들아...",1,1,0,1,0,0,0
1385,"이게 실제다! 한 해에 연수 200~300시간씩 듣는데 '인성교육 연구보고서 작성법'처럼 정말 이게 실제다! 싶은 연수는 처음이었어요. 보통 교과관련은 사례 공유와 이론적 설명을 해주고, 자기계발연수는 배우거나 힐링하는 기분으로 수강했습니다. 하지만 이연수는 메모하고 줄치면서 봤네요. 목표가 뚜렷한 연수이기도 하지만 일반 보고서 작성이나 기획, 계획서를 쓸 때 활용하기에 좋은 팁들이 있어서 중경력(10년 내외)의 교사들이 들으면 좋을 것 같은 연수였습니다. 저도 아는 교사에게 추천받아서 듣게 되었는데 보고서 작성에 관심 있거나 연구 쪽 업무를 하는 동료들에게 추천해 주고 싶은 연수였습니다. 이게 리얼! 같은 연수입니다.",1,1,0,1,0,0,-1
1386,많은 도움이 되었ㅇ쓰빈다. 신규교사로 많은 도움을 얻어서 좋았습니다.,1,1,0,1,0,0,0
1387,"추천합니다. 이런건 어디서 가르쳐 주지 않는 건데 연수로 개설되어서 너무 좋네요!!

강사님들 넘 감사합니다!!",1,1,0,1,0,0,0
1388,"좋았습니다. 딱딱하지 않고 친근하게 이야기 하듯이 설명해주어서 더 이해하기 쉬웠습니다.
좋은 연수 감사합니다.",1,1,0,1,0,0,0
1389,"개선 요구 1, 2 페이지의 동영상을 한번에 처음부터 끝까지 다 들어야만 진도가 체크되는 것은 매우 불합리하다. 수업에 들어가야 하거나 사정상 중단해야 하는 경우가 생기는데, 나중에 그 자리부터 재생하거나, 총 재상시간이 충족되면 진도를 나간 것으로 해야 한다.

1.5배속도 안 되고, 앞부분에 보았던 내용을 진도 체크를 위해 처음부터 다시 보아야 한다는 것은 바쁜 시간을 쪼개어 여러 업무를 처리해야 하는 교사에게 적절하지 않다.

이런 불편한 점이 개선되지 않으면, 티셀파연수원은 앞으로 이용하고 싶지 않다.",1,-1,0,-1,0,0,0
1390,손그림이 재미있어요~~^^ 호기심에 들어봤던 손그림 연수인데... 지금은 선물로 받은 도와지와 연필이 금세 없어지고 있어요. 나도 모르게 또 그림을 그리고 있네요. 자세하고 섬세하게 잘 연수해 주셔서 많은 도움과 즐거움을 주셨습니다. 감사합니다~~^^,1,1,0,1,0,0,0
1391,실제적인 예를 통해 많은 도움이 되었습니다. 사회 수업에서의 학생들의 참여에 대해 생각해 볼 수 있었습니다.,1,1,0,1,0,0,0
1392,정말 쉬운 과학 이야기 모든 영역을 망라한 이 연수는 과학에 대한 기초부터 차근차근 쉽게 설명해주는 부분이 너무 인상 깊었다. 단순히 이수를 위한 연수가 아닌 참된 앎을 위한 유익한 연수가 되었다. 무엇보다도 평소에 어렴풋이 알고 있던 다양한 과학적 상식들을 연수를 통해 보다 명확하게 알게 되었고 더 깊이 탐구하고 공부해보고자 하는 마음이 들 정도였다. 초등학교지만 내가 들은 연수 내용으로 학생들에게 설명을 해주며 이해해가는 과정이 더욱 알찬 연수지 않았나 생각이 든다. 추후에도 이와 유사한 연수 과정이 많이 개설되어 과학에 대한 기본적 소양을 높일 수 있는 계기를 마련해 주었으면 좋겠다. 추가적으로 덧붙이자면 학생들을 대상으로 교육을 할 수 있는 수준으로 조율된 연수가 개설되면 학생들이 과학에 대한 흥미를 많이 높일 수 있는 기회가 되지 않을까 한다.,1,1,0,1,0,0,0
1393,"수업자료 제작 평상시 출판사에서 제공된 PPT자료를 다운 받으면 뭔가 좀 부족한 느낌이 들었는데...
파워포인트 연수를 듣고 원하는 수업자료개발을 하니 넘 편하고 좋네요.
강의도 다양한 예제를 통하여 사용방법을 설명해 줘서
다양한 컨텐츠 제작에 많은 도움이 되는 연수였습니다.
이제는 자유자재로 파워포인트를 사용할 수 있고 편집, 컨텐츠 제작등..... 뭐든지 전문적으로 공부해야하는듯....ㅎ",1,1,0,1,0,-1,0
1394,"그림을 통하여 아이들과 마음 트기 논리적이고 따지기 좋아하는 제가 그 틀을 깨고 싶어서 신청한 연수였습니다. 그림과 만들기 등 여러가지 미술 활동을 통해 학생들과 가까워질 수 있는 방법이 많다는 것을 이 연수를 통해 배웠습니다. 과자로 집 만들기가 특히 기억에 남았고 집 그리기, 나무 그리기, 다리 위의 사람 그리기, 나를 상징하는 표현 만들기, 내가 좋아하는 내 모습과 내가 싫어하는 내 모습, 그림으로 대화하기, 비속의 사람 그리기 및 발달 단계에 따른 그림의 변화 등 다양한 미술을 통한 소통 방법이 있다는 것을 알게 된 귀한 시간들이었고 저를 낮추는 기회도 되었습니다. 내년에도 티셀파에서 좋은 연수 듣고 싶습니다. 감사합니다.",1,1,0,1,0,0,0
1395,기후와 우리 생활의 밀접한 관계 우주 속의 인간은 지구라는 보금자리가 없으면 살아갈 수 없습니다. 하지만 인간들의 무분별한 개발과 이기적인 편의를 위해 지구 환경을 파괴해 온 결과 인간의 유일한 보금자리마저 위태로운 실정이라는 것을 알게 되었습니다. 최근 탄소중립과 관련하여 이슈가 많은데 저도 아이들이 살아갈 푸르른 미래를 위해 무엇을 해야할지 알아갈 수 있었던 연수였습니다.,1,1,0,1,0,0,0
1396,아직은 어렵게만 느껴집니다. 워낙 여행을 좋아하고 여행 후 항상 sns에 여행 후기를 작성하는 습관을 가지고 있는데 강의를 통해 들어도 아직은 책 제작은 어렵게만 느껴집니다. 다만 여러가지 소소한 아이디어는 얻어갑니다. 매 강의 말미에 여러 나라에 대한 강의는 크게 도움되지 않아서 약간 시간때우기식 끼워넣기 내용이 아닌가 생각이 들었습니다.,1,-1,0,-1,0,0,0
1397,"무료 연수라 기대없이 들었는데 유익합니다 연수 시간도 시간도 짧고 지루하지 않아서 좋았습니다.
굉장히 유익했습니다.",1,1,0,1,0,0,0
