,text,score,jaehyeong/koelectra-base-v3-generalized-sentiment-analysis,klue/bert-base,matthewburke/korean_sentiment,monologg/koelectra-base-v2-discriminator,skt/kogpt2-base-v2,beomi/kcbert-large
2010,"보다 건강을 챙기게 되었습니다. 평소 건강에 자신이 있었으나 어느 덧 교직 경력이 늘어가며 체력이 딸리는 것을 느낍니다.

특히 계절이 바뀔 때나 스트레스가 심한 경우 심적인 부분이 몸으로 나타나는 걸을 보고 더 이상 건강을 자신할 수 없다는 것을 깨닫고 연수를 신청하였습니다.

목이나 허리, 전체적으로 체력이 저하되며 각종 몸의 이상 증상 등에 보다 관심을 기울이며 제 몸이 보내는 신호를 감지하고 제 몸을 챙겨야 한다는 점을 연수를 듣는 과정에 또 한번 느끼게 됩니다.

연수를 통해 만성질병을 다스리며 이를 예방하는 법을 알게되어 보다 건강을 위해 노력해야겠음을 깨닫고 이를 실천하고자 합니다!

모든 선생님들도 건강 관리 잘하시기 바랍니다",1,1,0,1,0,0,0
2011,"여성 건강에 무지했던 저를 반성합니다. 여성으로서 제 건강에 너무 무지했다는 생각이 듭니다.

특별히 아픈 곳이 없고 아직은 건강에 자신할 수 있는 나이라고 착각했던 것 같아서 연수를 통해 제 몸에 대해 잘 이해하며 여성 건강에 관심을 기울이게 되었습니다.

아이들에게는 이론을 알아야 한다면서 수업을 하지만 막상 저는 제 몸에 대해 잘 모르고 있었다는 점에서 참 유익하면서 느낀바가 많은 연수였습니다.",1,1,0,1,0,0,0
2012,"학생과 교사가 행복한 학급을 만들 수 있을 것 같아요^^ 현장사례와 액션 플랜을 통하여 자존감을 회복할 수 있는 솔루션과 학생 긍정 마인드 셋 형성을 위한 구체적인 활동과 방법을 알 수 있어서 너무 좋았고 '행복한 학급만들기, 학생과 교사 자존감 수업' 연수를 통해 앞으로 학생과 교사가 행복한 학급을 만들 수 있을 것 같습니다^^",1,1,0,1,0,0,0
2013,"좋은 강의였어요~ 학교 일과 중에 강의를 듣기란 쉽지 않았지만!
재미있고, 유익한 내용이 많아서 좋았어요.
꼭 복습하며 내 것으로 만드는 연수이고 싶습니다 ^^",1,1,0,1,0,0,0
2014,"교사 자존감의 중요성을 다시끔 느꼈습니다. 교직 경력이 쌓여갈수록 아이들 앞에 서는 것이 익숙해지기 보단 점점 제 자신이 부족하고 해 줄 수 있는 것이 많이 없다는 사실에 작아집니다.

이런 시점에 접한 연수라 교사 자존감의 중요성 및 제 스스로에게도 힘을 될 수 있는 연수라 도움이 많이 되었습니다.

제 자신부터 바로 서고 자존감을 회복해야 저를 만나는 아이들에게도 긍정의 힘을 줄 수 있다고 생각합니다.

다른 선생님들께서도 모두 힘내시길 바라봅니다.",1,1,0,1,0,0,0
2015,"재밌었어요..^^ 미술 수업에 늘 자신이 없었는데...

연수에서 수업하시는 장면까지 나와서 유익했어요...

재밌는 연수 감사드리구요...

수업에 활용할 거리가 많은 것 같아요..^^",1,1,0,1,0,0,0
2016,"연수 좋았어요... 사실 제가 아이들을 가르치는 교사지만 우리나라를 위해 애쓰신 의병들의 존함, 업적 등은 잘 몰랐습니다.. 이번 연수를 통해 그 분들의 발자취를 조금이나마 알게 되서 기쁘네요...^^

우리나라 국민으로서 의병들의 활약, 활동을 알게 되서 좋습니다. 감사합니다. 앞으로 사회 가르칠 때 뒷이야기도 살자쿵 말할 수 있을 것 같아요..^^",1,1,0,1,0,0,0
2017,미술실력 기르기 미술에 자신이 별로 없어서 미술시간에 주로 만들기만 했었는데 이번 연수를 듣고 수채화 지도를 해보니 쉽고 재밌었습니다~ 여가활동으로도 미술활동은 참 좋운 것 같아요.,1,1,0,1,0,0,0
2018,유익한 연수였습니다. 다소 생소한 의병에 대해 자세히 알수 있는 유익한 연수였습니다. 추천합니다!,1,1,0,1,0,0,0
2019,좋은 연수였습니다. 코로나19로 인해 옴짝달싹 할 수 없는 요즘 본 연수를 통해 여행의 설레임을 잠시나마 느낄 수 있었습니다.,1,1,0,1,0,0,0
2020,"힐링되는 연수 그리기에 자신없는 교사 입니다.
샘플강의를 듣고 망설임없이 선택했고 강의는 훌륭했습니다.
스케치북 필통 펜도 바로 발송해주셔서 알찬 강의가 이루어졌습니다.
강의 내용 역시 힐링이 되는 연수 였습니다.
특히 그리기 부분은 종이의 촉감과 펜의 질감을 느낄수 있어서 힐링이 되었습니다. 감사합니다.",1,1,0,1,0,0,0
2021,"기초부터 다시 다지기 영어 문법은 계속 잃어 버리는 경우가 많아요~
때문에 다시 한번씩 복습해주는 연수가 꼭 필요합니다.
이번연수를 통해서 다시 한번 영어 문법을 다지게 되는 계기가 되었습니다^^",1,1,0,1,0,0,0
2022,"문학 속 지리이야기 연수 후기 연수를 통해 동화에서 소설까지 15가지 문학 작품을 지리적 시각으로 살펴 보았다. 문학의 공간이 단순한 배경으로 치부되지 않고 작품 안에서 어떤 결정적 역할을 하는지 살펴봄으로써 지리학뿐 아니라 문학의 지평 또한 넓힐 수 있는 기회가 되었다.
문학 작품을 읽을 때 다양한 관점으로 살펴보는 재미에 더 즐겁게 연수를 들을 수 있었다.",1,1,0,1,0,0,0
2023,"시간을 걷는 인문학 연수 후기 연수를 통해 각각의 길을 둘러싼 사건과 사람들, 지리적 특징을 이정표 삼아 사회, 문화, 경제, 환경 등의 주제로 인문학 여행을 떠날 수 있었다. 익숙히 들어 본 역사 속의 길뿐만 아니라 우리 주변 일상적 장소들을 탐방하며 지식을 얻고, 생각거리들을 통해 다양한 관점을 키워나가는 유익한 연수였다.
길이 아닌 곳도 사람들이 많이 다니면 새로운 길이 되듯이 시간을 걸으며 다양한 생각을 할 수 있어 힐링의 시간이 될 수 있었다.",1,1,0,1,0,0,0
2024,"좋은 연수였습니다. 교실이나 강당에서 아이들과 함께할 수 있는 여러 놀이에 대해 잘 배웠고, 활용했습니다.",1,1,0,1,0,0,0
2025,좋았어요!! 상황별로 유용하게 사용할 수 있는 여러가지 회화 표현이 많아 좋았어요. 나중에 해외에 나갔을 때나 원어민을 만났을 때 자신감 있게 사용할 수 있을 것 같아요! 선생님도 스마일하시며 수업하시는 모습도 좋았구요! 많이 배웠습니다!!,1,1,0,1,0,0,0
2026,실제 수업에 큰 도움 되는 연수 교과 수업 외에 창체 지도로 진로 수업을 맡을 때가 종종 있는데 그때마다 참 난감했습니다. 이번 연수를 들으면서 직접적으로 큰 도움 받았습니다. 중간중간 선생님들의 예시도 좋았습니다. 교육현장에 꼭 필요한 연수 감사드립니다!,1,1,0,1,0,0,0
2027,좋았어요!! 상황별로 유용하게 사용할 수 있는 여러가지 회화 표현이 많아 좋았어요. 나중에 해외에 나갔을 때나 원어민을 만났을 때 자신감 있게 사용할 수 있을 것 같아요! 선생님도 스마일하시며 수업하시는 모습도 좋았구요! 많이 배웠습니다!!,1,1,0,1,0,0,0
2028,재밌었어요!! 상황별로 유용하게 사용할 수 있는 여러가지 회화 표현이 많아 좋았어요. 나중에 해외에 나갔을 때나 원어민을 만났을 때 자신감 있게 사용할 수 있을 것 같아요! 선생님도 스마일하시며 수업하시는 모습도 좋았구요! 많이 배웠습니다!!,1,1,0,1,0,0,0
2029,체육이 항상 어려웠던 쌤들에게 추천~ 체육수업이 가장 어려워서 스강이나 교담이 맡아줬으면 하는 과목 1위였는데 이제는 다양한 활동을 시도해볼 수 있어서 좋습니다~!,1,1,0,1,0,0,0
2030,"유용했습니다. 일본어를 아예 모르는 상태로 들었는데 이제는 보이는 일본어는 다 읽을 수 있어요~ 가벼운 회화정도도 가능할 것 같아요~
강의를 듣더라도 본인이 가장 열심히 해야 가능하지만 이 강의 덕분에 핵심 위주로 잘 배운 것 같아요.
너무 유용하고 뿌듯한 연수였습니다^^",1,1,0,1,0,0,0
2031,"세상에서 제일 쉬운 과학 이야기 연수 후기 학창시절 과학을 좋아했으나 어려운 이론 때문에 항상 힘들어했던 기억이 있다. 교사가 되어 아이들에게 과학을 가르치려다 보니 내가 아는 과학 이론이 맞는지 확신에 차지 않아 항상 다시 공부하게 되곤 했다. 과학을 가르치는 것이 쉽지 않았다고나 할까?
이 연수를 통해 과학의 발전 흐름을 과학사를 통한 사례와 과학에 대한 교과서 외의 다른 시선에서의 접근 방법을 살펴볼 수 있어 좋았다. 단순히 과학이론을 접하고 암기하는 것이 아니라 이해를 통한 통합적인 사고 및 응용을 할 수 있게 해주었다.
아이들에게 과학을 가르칠 때 단순히 이론만을 가르치기 보다 사례와 이해를 통한 다양한 방향으로 접근하는 것도 괜찮겠다는 생각을 했다.",1,1,0,1,0,0,0
2032,"색다른 연수 선생님의 설명이 쉽고 자세해서 좋았습니다.
그림 그리는 방법이나 노하우를 알게 되어 유익했습니다.
학급 활동이나 수업시 문서 등을 제작할 수 있는 노하우를 알게 되어 유익했습니다.
연수 전 보내준 그리기 도구(마커 등)가 매우 유용했습니다.

다만..(경기도)학교 컴퓨터에는 파워포인트를 사용하지 않고 한쇼를 사용하는데, 파워포인트 프로그램이 없어 제대로 따라하지 못했습니다.
한쇼에서는 파워포인트를 불러올 수 있지만, 연수 내용처럼 따라할 수 있는 주요 기능이 달라 실제적으로 따라할 수 없어서 아쉬웠습니다.",1,1,0,1,0,0,-1
2033,"아이들 생활지도에 어려움을 느낀다면... 교육경력이 아무리 오래 되어도 언제나 힘든 것이 아이들 생활지도다. 아이들마다 다르고, 그때 그때 다른 것이 생활지도와 상담이다보니 내가 지금 제대로 하고 있는 지도 확신이 서지 않는다.
이 연수를 통해 아이들을 가르치고 생활지도하면서 나만 힘든 것이 아니고, 다들 많이 힘드시다는 것을 알았고, 그래서 더 많이 공감할 수 있었다. 또한 생각해볼만한 생활지도 팁도 몇 개 얻을 수 있었다.
동료 선생님과 티타임 나누며 이야기나누는 듯한 힐링의 연수였다고 생각한다.",1,1,0,1,0,0,0
2034,"손그림과 파워포인트로 교실 속 콘텐츠 만들기 그림을 잘 그리는 것도 아니고, 그렇다고 못 그리는 것도 아닌 것 같고, 아이들과 수업을 할 때 텍스트만 활용하지 않고 이해하기 쉽게 그림까지 곁들이고 싶은 마음이 가득한 선생님들이라면 꼭 들어야 하는 연수라고 생각한다.
쉽게 손그림 그리고 수업에 활용하는 방법, 파워포인트를 활용하여 쉽게 그림그리고 수업에 활용하는 방법 등 다양한 컨텐츠 제시를 통해 교사가 쉽게 수업에 그림을 적용할 수 있게 도와준다. 100퍼센트 다 따라해보면 참 좋겠지만, 그 중 몇 개만 내 것으로 만든다면 성공한 연수인 것 같다. 복습하면서 꾸준히 손그림과 파워포인트를 연습하여 꼭 수업시간에 활요해보려 한다.",1,1,0,1,0,0,0
2035,건강에 관심!! 요즘들어 건강에 관심이 많이 가는데 여성과 관련된 연수를 들으며 메모까지 했어요~~유용한 연수같습니다.,1,1,0,1,0,0,0
2036,온작품 읽기의 깃대!! 국어수업과 관련하여 온작품 읽기가 교육과정 속에 들어와있지만 온작품 읽기를 도대체 어떻게 해야하나 고민이 있을 때 들었던 연수입니다. 온작품 읽기가 무엇인지 또 온작품 읽기의 적용 방법이 자세히 나와 유용했던 연수로 추천합니다.,1,1,0,1,0,0,0
2037,"과학 이야기=인간의 발전 이야기 제가 과학에는 관심은 있지만 어려운 분야로 느껴서인지 쉽게 다가가진 못했어요. 연수를 들으며 미리 배송왔던 교재(통통한 과학책)을 함께 봤어요! 책도 나름 좋았지만 아무래도 강의에서 강사님이 말씀하시는 것들이 이야기하듯 술술 말해주셔서 훨씬 듣기가 좋았어요.
이번 연수를 들으면서 놀랐던 것이 이런 물리, 화학, 생물, 지구과학이라는 과학의 발전은 인간역사의 발전이라는 것을 그리고 이것을 알고나니 훨씬 세계사를 이해하기 쉬었다는 것이었어요! 그래서 역사공부하듯이 재밌게 연수르 들었습니다.
저같은 과학이 낯설게 느껴지는 분들이면 도움이 많이 될 것 같습니다!",1,1,0,1,0,0,-1
2038,"단순한 영어 패턴, 큰 효과 자주 사용하고 단순한 영어 패턴을 다룬 연수이지만, 활용도는 100%라고 생각합니다. ^^ 다른 관련 영어 연수도 듣고 싶어요!",1,1,0,1,0,0,0
2039,코로나 시대 힐링 연수 코로나 시대 힐링 연수입니다! 좋은 연수 내용으로 큰 도움이 되었습니다.,1,1,0,1,0,0,0
2040,많이 배울 수 있는 시간이었어요. 상식이 부족한 편이어서 아이들 가르칠 때 고민이 되었는데 이번 연수를 통해서 인문학적 교양을 넓힐 수 있어서 좋았어요,1,1,0,1,0,0,0
2041,"교과연계 진로 수업 진로교사들은 이미 알고 있는 내용이 대부분 이지만, 일반교과 선생님들이 각 교과 수업과 진로교육을 연계하여 활용할 수 있도록 되어있어서 도움이 될 것 같습니다. 또한 커리어넷, 워크넷, 꿈길 사이트 활용 등의 내용이 포함되어 있어서 유익하였습니다.",1,1,0,1,0,0,0
2042,"알찬 진로 연수였습니다. 진로교육에 대해 진지하게 생각하게 되는 연수였습니다.
다음에도 또 듣고싶네요",1,1,0,1,0,0,0
2043,아이들을 이해하는데 좋은 연수 아이들의 감정을 이해할 수 있는 미술 관련 활동을 자세히 다룬 연수라서 교육 현장에서 큰 도움이 되는 연수라고 생각합니다.,1,1,0,1,0,0,0
2044,"목소리도 좋으시고 강의도 잘하세요. 말 그대로 기초적인 내용이지만, 기초를 다질 수 있어서 좋습니다.",1,1,0,1,0,0,0
2045,편안하게 들을 수 있는 연수 연수 과정 중에 스트레스 받지 않고 편안한 마음으로 들을 수 있는 연수입니다.,1,1,0,1,0,0,0
2046,유익한 재무설계 본 강의를 듣고 다시 나의 재무지표를 돌아보는 시간이 되었습니다. 앞으로 좀더 경제 공부를 해 보는 시간을 갖도록 노력해야 되겠네요.,0,1,0,1,0,0,0
2047,연수 강추 초저학년의 남학생들을 지도하는데 실제적인 도움이 많이 되었음. 실제 아들을 키우며 남학생들을 지도해 본 경험이 많은 강사선생님의 솔직하며 담담한 강의 내용이 여학생들에 비해 다루기 힘든 남학생을 이해하는데 도움이 됨. 한번쯤 꼭 들어봐야하는 연수,1,1,0,1,0,0,0
2048,"강추 강추 진로는 진로시간에만 배우는 거야라는 나의 편협한 생각을 깨고 진로교육은 특정 시간이 아니라 전 교과에서 이루어지는 것임을 확인하고 확인했던 시간이었습니다.
명쾌한 강의, 깔끔한 교안, 다양한 사례 나누기 등을 통해서 수업의 전문성도 얻게 되었습니다. 문의사항을 물어 보면 빠른 답변, 친절한 해결....보기 드문...대만족한 연수였습니다, 감사합니다.",1,1,0,1,0,0,0
2049,"그림 좋아하시는 선생님들~ 저는 손재주가 없어서 보기만 했는데요~T.T
손그림 좋아하시는 선생님들 보시고 학급 아이들에게 적용하시면 좋을듯합니다.
재미난 연수 올려 주셔서 감사합니다.",1,1,0,1,0,0,0
2050,"대혜자인 연수!!! 손그림 그리기에 필요한 재료도 보내주시고, 저처럼 똥손인 사람도 쉽게 활용할 수 있는 기초를 알게 되어서 좋았어요! 강추합니다!!!",1,1,0,1,0,0,0
2051,"인문학의 재미를 느꼈어요 길을 주제로 하는 이야기에 흠뻑 빠지는 시간이었습니다.

평소 크게 관심을 두지 않는 주제였으나 연수를 통해 내가 다니는 길에는 어떤 의미가 있으며, 내가 사는 고장의 길과 시간, 역사 등에 대해 생각해 보는 시간을 가지는 기회가 되었습니다.

잘 알려진 곳 뿐 아니라 낯선 곳을 접하며 연수에서 다룬 장소나 공간, 길을 찾아가는 테마를 여행을 가보고 싶어지네요.

인문학의 범위를 더 넓게 이해하면서 지리의 묘미를 느끼게 되었다는 점에서 유익한 연수였습니다.",1,1,0,1,0,0,0
2052,"즐겁고 새로운 지리 이야기였습니다. 오랜만에 즐겁고 풍성한 연수를 수강하여 참 만족스러웠습니다.
지리 분야는 제 전공 분야가 아닐 뿐더러 학창 시절 많이 어려워했던 부분이 커서 과연 잘 따라갈 수 있을지 자신이 없었는데
친숙한 작품들을 통해 숨겨진 지리적 요소 및 상황, 배경, 생각지도 못한 새로운 지식이나 이야기들 속에서 지적 성장을 경험한 시간이 되었습니다.
저 뿐 아니라 제가 가르치는 아이들에게도 유익한 정보와 흥미있는 내용들이 많아서 이를 수업에 접목해보고 싶은 생각이 듭니다.
또한 교재도 제공받아서 연수를 듣는 부분에 있어서도 많은 도움을 받아서 좋았습니다.
다른 선생님들에게도 추천하고 싶은 연수로 기억에 많이 남을 것 같습니다.",1,1,0,1,0,0,-1
2053,이해하기 쉬운 패턴잉글리쉬 이해하기 쉽고 기억하기 쉬운 연수였습니다. 감사합니다~^^,1,1,0,1,0,0,0
2054,"진로교육의 중요성을 인식하고, 각 교과 수업에 적용하자! 교과수업에 활용하는 진로교육이라는 유익한 연수를 수강한데 대해 우선 감사의 인사드리며, 또한, 진로와 직업교과에서의 진로수업만이 아니라, 자유학기제의 도입 목적을 인식하고, 각 교과에서 진로교육의 중요성을 인식하여 적용한다면, 후세들이 미래에 대비한 진로 역량을 갖춰 행복한 미래를 준비하리라 사료된다.",1,1,0,1,0,0,0
2055,"선긋기 연습 종이만으로 칭찬 가득 받은 손그림 그리기~^^ 선긋기를 연습한다고 한 종이를 본 1학년 우리반 친구들~~
""선생님 그림 진짜 잘 그린다."" (난 선을 여기저기로 바르게 그었을 뿐인데... 뭘 잘 그렸지?)
""어디어디"" ""어디 그렸는데?""(자꾸 나오지 마라)
""선생님 이건 뭐에요?""(젠팅글이라는 건데 어찌 설명하지)
연습한거라는 말에 ""선생님은 원래 잘 그리는데 연습해야 해요?""(너희가 보기엔 그런거야~)

정말 부끄러운 실력에, 1학년 학생들에게 좀 더 재미있게 다가가기 위해 신청했는데 뭐하나 그리기도 전에 친구들에게 칭찬을 받았습니다.
얼굴을 그리고 간단한 동물을 그리고 마을 꾸미기를 할 땐 마을도 간단하게 그리니 여기저기서 ""우와~"" ""우와~""
교사의 자신감을 높여주는 손그림그리기~ 감사합니다.^^",1,1,0,1,0,0,-1
2056,"연수를 듣고 나서~ 정은경 선생님은 통통한 과학을 통해 알고는 있었습니다.

책의 저자의 이야기를 이렇게 들을수 있다는 자체가 너무 좋았습니다.

강의 하시는 열정과 과학사를 통해 내용을 쉽게 전달하려는 모습이 보이네요..

잘 들었구요 많은 도움이 되었습니다.. 감사합니다.",1,1,0,1,0,0,0
2057,"부담없지만 유익한 연수 부담없지만 도움이 많이 되는 유익한 연수였습니다.
건강에 대한 기본적인 상식이 많이 쌓였습니다.

특히,
간헐적 단식, 보충제 관련한 다이어트 부분과
비타민 부분은 많은 도움이 되었습니다.

연수를 통해 알게된 내용을 가지고
앞으로도 건강한 삶을 유지하고 싶습니다.",1,1,0,1,0,0,0
2058,"흥미로운 과학사를 접하는 시간이었습니다. 과학과는 거리가 먼 교과를 담당하고 있기에 어려울까봐 연수를 신청하면서도 걱정이 많았습니다.

교재도 받았으나 내용보다는 그림에 겁먹기도 했고요.

그러나 차분히 연수해주시는 선생님의 이야기에 절로 빠져들면서 과학사의 묘미를 느끼는 시간이었습니다.

또 평소 들어만 봤던 과학의 개념이나 과학 용어를 접하며 의미를 알게 되면서, 혹은 내 주변에서 접했던 과학적 요소들을 통해 과학이 실생활과 밀접하며 참 흥미로운 교과라는 사실을 발견했습니다.

과학이 흥미롭고 실생활에 꼭 필요하다는 점에서 문이과 통합 과정 속 제 수업에도 충분히 활용하여 학생들에게 도움이 되는 수업을 설계해봐야겠다는 생각을 하게되었습니다.",1,1,0,1,0,0,0
2059,"연수 후기 실제 수학수업을 어떻게 진행했는지 관련 동영상을 볼 수 있어서, 아이들 수학지도에 도움이 되었습니다.",1,1,0,1,0,0,0
2060,자존감수업 수업에서 교사의 자존감은 가장중요합니다. 자존감을 통해 수업에 집중할수 있습니다.,1,1,0,1,0,0,0
2061,"원하던 강의 원래 손그림을 좋아하는데 소위 말하는 '똥손'이라 그림을 그리는게 늘 부담스러웠습니다. 그래서 그저 잘 그리는 사람을 부러워하고 책을 사서 따라해 보려고도 노력해도 따라그리기조차도 원래 그리려던 대상과 다르게 그려지기에 스스로에게 화가 나서 포기하고 있던 상태였습니다.
그러던 중에 이 연수를 알게 되었고 너무도 친절하게 하나하나 설명해 주시는 강사님 덕분에 '나도 할 수 있겠구나!'하는 자신감을 갖게 되었습니다.
연수를 보면서 강사님과 함께 하나하나 따라그려볼 때는 조금 알 것 같았는데 연수가 끝나고 나니 또 가물가물하네요.ㅠㅠ
재수강 기간이 끝나기 전에 다시 한 번 더 강의를 복습하고 틈틈이 손그림을 연습해서 학생들에게 시각적으로도 재미있고 기억에 오래 남는 수업을 제공하고 싶습니다.",1,1,0,1,0,0,0
2062,자존감 수업 항상 학생을 생각하면서 수업을 준비해야되겠고 또한 나 자신의 자존감을 높이는 계기가 되어야할것 같습니다.,1,1,0,1,0,0,0
2063,여행인문학 여행을 통해 다양한 삶을 체험할수 있어서 좋은 연수였던것 같습니다.,1,1,0,1,0,0,0
2064,여성건강 여성의 건강을 통해 다양한 질병을 알고 이에 대처하는 방법을 알게되었습니다.,1,1,0,1,0,0,0
2065,톡톡한국사 한국사를 통해 다양한 삶을 알아보는 좋은기회가 된것 같습니다.,1,1,0,1,0,0,0
2066,정말 꿀팁같은 연수...^^ 컴퓨터로는 한글과 인터넷만 할 수 있을 정도로 컴맹인데...온라인 수업이 확대되면서 겁이 날 정도로 걱정이 많이 되었습니다. 어떻게 온라인 수업을 해야할지...자료는 어떻게 제작해야 할지...여러 가지로 복잡했는데...이번 연수로 고민 해결...^^ 정말 옆반 선생님 같은 선생님들께서 알려주시는 꿀팁으로 온라인 수업에 한 걸음 다가갈 수 있을 것 같습니다. 나이가 좀 있어도 젊은 쌤들 못지않게 도전~!! ^^ 앞으로 자신감 무장...아이들에게 더욱 적극적으로 다가가는 교사 되겠습니다....좋은 연수 개설해 주신 티셀파 연수원...그리고 강사 선생님들게 진심으로 감사드립니다...(완벽한?!! 실제를 위해 다시 복습 들어갑니다~~~ ^^),1,1,0,1,0,0,-1
2067,"남학생 탐구 남학생들은 여학생과 다르다라는 것은 학생들을 지도하다보면 어렵지 않게 느끼고 접할 수 있다. 하지만 이러한 사실들을 직접 교육 현장에서 지도하시는 담임 선생님께서 경험담을 이야기해 주시면서 하나씩 소개하여 주십니다. 강의 계획서를 보시면 남학생들의 탐구 일대기를 보실 수 있으실 겁니다. 학교 현장의 남학생을 지도하시는 선생님 뿐만 아니라 댁에서 남자 아이를 키우는 부모님들의 육아 지도서로도 좋을 것 같습니다.

요즘 같이 남학생과 여학생의 비율이 불균형하거나 남학생들이 여학생화 되어가는 상황에서는 더더욱 이 연수가 도움되실 것 같습니다. 남학생은 남학생대로의 특성대로 여학생은 여학생대로의 특성대로 태어나서 자신만의 고유한 특성을 발산하며 지키고 가꾸면서 살아갈 수 있도록 교사는 도와줄 수 있는 남학생 탐구 강의라고 생각하시면 됩니다.

선생님들의 연수 선택에 탁월한 선택이었다고 생각하실 수 있습니다. 추천드립니다.",1,1,0,1,0,0,0
2068,지리를 통한 문학 이해하기 문학에 등장하는 지역에 대한 해석을 이해할 수 있는 기회가 되어 좋았습니다.,1,1,0,1,0,0,0
2069,여성 건강 건강의 중요성에 대해 알게되었습니다.,1,1,0,1,0,0,0
2070,패턴으로 영어 익히기 패턴을 외우면 영어가 저절로 되는 연수입니다. 열심히만 하면 영어 실력을 향상시킬 수 있을거에요. 여러가지 패턴을 익히고 응용하기 좋습니다.,1,1,0,1,0,0,0
