,text,score,jaehyeong/koelectra-base-v3-generalized-sentiment-analysis,klue/bert-base,matthewburke/korean_sentiment,monologg/koelectra-base-v2-discriminator,skt/kogpt2-base-v2,beomi/kcbert-large
706,일본어 첫걸음에 도움이 되는 연수입니다. 완전 처음 접해보는 일본어라 1강 내용부터 쉽지는 않았어요. 영어 알파벳 처음 시작하는 마음으로 일본어도 첫걸음부터 조금씩 익혀나가니 완전 생소한 일본어도 조금씩 친근하게 다가옵니다. 노래로 배운 내용을 복습해주고 강의도 재미있게 진행해주시면서 일본과 한국의 문화 차이도 설명해 주셔서 단순 일본어 강의를 넘어 타문화를 접해보는 기회도 되는 연스였습니다. 일본어 마스터1과 함께하면 일본어 첫걸음 모두 성공하실 것 같습니다. 모두 화이팅입니다~!,1,1,0,1,0,0,0
707,자꾸자꾸 듣고 싶은... 어렴풋이 알고 있었던 인문학 상식들에 대해 확실하게 알게 되었고 더욱 호기심과 궁금증이 생기게 하는 멋진 연수였습니다.,1,1,0,1,0,0,0
708,좋은 연수 감사합니다. 파워포인트를 활용하여 디테일하게 배울 수 있는 좋은 기회였습니다. 강추합니다.,1,1,0,1,0,0,0
709,선생님의 강의가 명가의 입니다. 김준우 선생님의 쉽고 재미있는 강의 덕분에 한국사 실력이 한층 올라간 것 같습니다. 많은 도움이 됩니다.,1,1,0,1,0,0,0
710,"영어 연수는 이것으로 시작됩니다!! 초등 영어 선생님이라면... 항상 고민되는 생활영어!!!

정말 메이슨의 2가지 원격 연수를 통해서 많은 문장을 알고 수업에 적용할 수 있었습니다.

메이슨의 생활영어 --> 메이슨의 여행 영어로 순차적으로 청강하시면 정말 도움이 많이 될 꺼에요!!!

과제도 쉽고 ^^ 시험도 쉽고 ^^ 선생님을 배려하는 티셀파 연수원이네요~~

오늘 하루도 고생하셨고 항상 건강하세요!!",1,1,0,1,0,0,0
711,독립운동 현재 우리가 잊지 말아야 될 중요한 선조들의 모습 독립운동에 대한 역사는 학창시절 역사공부를 할 때 가장 꺼려하고 힘들어했던 부분이다. 하지만 그 짧은 기간에 나라를 잃고 우리 조상들이 그 나라를 되찾기 위해 목숨을 걸고 투쟁한 사건이 그렇게 많았다는 점을 되돌아보며 저절로 머리가 숙여진다. 그들이 있었기에 우리가 누리는 자주 국가가 있음을 잊지 말아야할 것이다.,1,1,0,1,0,0,0
712,재밌습니다 노션 잘 알려줘서 재밌습니다,1,1,0,1,0,0,0
713,박물관을 구경하는 좋은기회 직접 방문하지 않아도 랜선으로 박물관을 구경할 수 있어서 너무 행복했습니다~ 요즘같은 코로나로 대면이 어려운 시기에 여러 종류의 박물관을 알아봐서 너무 유익한 연수였습니다!,1,1,0,1,0,0,0
714,"교사의 마음이 편해지는 연수 연수를 들으면서 내 자신도 편안해지는 시간이었습니다.
그리고 아이들에게 바로 투입해볼 수 있어서
무엇보다 의미있는 연수가 되었습니다.^^",1,1,0,1,0,0,0
715,생활 영어라 좋았습니다. 어렵지 않게 가르쳐 주셔서 감사합니다.,1,1,0,1,0,0,-1
716,"기대에 비해 실망.. 기대에 비해 실망이 매우 큰 연수였습니다.
일단 연수 명칭부터 바꿀 필요가 있을 것 같습니다.
'고수들의 중국어 수업 지도법 엿보기'라는 연수명을 보고 기대를 가지고 수강 신청을 했는데,
중고등학생들을 대상으로 하는 수업에는 적합하지 않습니다.
미취학아동이나 초등학생 같은 어린이를 대상으로 하는 수업을 하시는 선생님들께나 필요한 연수입니다.
그리고 자막에 오타를 발견하여 문의 드렸는데 다음과 같은 답변을 받았습니다.
<담당자분께 확인했을 시, 做的太好了 와 做得太好了는 같은 뜻을 의미하여 做的太好了으로도 사용된다고 합니다.>
관형어의 표지인 的와 정도보어의 표지인 得는 엄연히 다른 것인데 저런 식의 답변은 전문가답지 않다고 봅니다.
중고등학생들을 위한 중국어 교수법과 관련된 연수가 개설되었으면 좋겠습니다.",-1,-1,0,-1,0,0,0
717,"역사를 잊지 말자 역사를 알아야 더 나은 미래를 만들수 있습니다. 우리 나라 역사에 대해 더 깊이 탐구할 수 있었던 의미 있는 시간이었고, 좋은 연수를 준비해 주셔서 감사합니다.",1,1,0,1,0,0,0
718,내 마음도 힐링되는 칼림바 연수~^^ 마스크 착용이 생활화되면서 아이들과 함께 교실에서 할 수 있는 악기 연주가 한정되어 너무 아쉬운 와중에 접하게 된 것이 칼림바였습니다. 너무 고운 음색에 제 마음도 힐링되는 듯하여 아이들과 함께하고 싶었는데 선뜻 칼림바 관련된 비대면 연수를 찾기 힘들었어요. 그러던 와중 따당~ 알게된 T셀파 칼림바연수!^^ 쉼고 차분하게 설명해 주셔서 똥손인 저도 즐겁게 배우고 있습니다. 내년에는 아이들과 칼림바 소리가 울리는 교실을 만들고 싶네요^^,1,1,0,1,0,0,-1
719,"손그림에 자신감이 생겼습니다 :) 손그림이라고 하면 항상 걱정이 앞서서, 잘 그려진 그림을 찾아서 사용했는데요. 이번에 연수를 들으면서 자신감이 생겼습니다. 물론 하루 아침에 잘 그릴수는 없겠지만 나도 잘 그릴 수 있겠구나라는 자신감을 가지게 되었어요. 간단한 부분부터 디테일한 부분까지 꼼꼼하게 설명을 해주셔서, 많은 도움이 되었습니다.
태블릿에서 사용하지 못했던 그림그리는 기능 및 색칠까지도 간단하게 알려주셔서 이제 종종 사용할 수 있게 되어서 너무 좋네요. 선생님들에게 강의 추천합니다 !!",1,1,0,1,0,0,0
720,"필수 직무 연수를 알차게 담았다 교원의무 연수가 많아서 일일이 찾아 듣기가 어려웠는데,
이렇게 패키지로 구성되어 있어 편리합니다.
또한 연수 분량도 길지 않아서 부담없이 듣기 좋았습니다",1,1,0,1,0,0,0
721,"연구보고서 준비에 필요한 바이블 연구보고서를 어떻게 작성하면 좋을지 멘토가 상세히 설명해주는 느낌이었습니다.
챕터별로 꿀팁과 유의사항이 잘 정리되어 있어서 보고서 작성에 큰 도움이 되었습니다.
스스로 복습하고 싶을만큼 좋은 연수였습니다.",1,1,0,1,0,0,0
722,쉽고 즐거운 체육수업 만들기 체육수업을 어떻게 운영하면 좋을 지에 대한 조언과 내용요소를 학습하면서 재미까지 얻을 수 있는 수업팁을 얻을 수 있어서 좋았습니다.,1,1,0,1,0,0,0
723,"내 손으로 만드는 고퀄 컨텐츠 만들기 여러 학습자료를 사용할 때, 저작권 문제가 있어서 사용이 꺼려졌던 경우가 종종 있었습니다. 다른 선생님들의 멋진 자료를 보면서 어떻게 만드는 건지 항상 궁금했는데, 이번 연수를 통해 나도 고퀄리티의 학습자료를 만들 수 있겠다는 자신감을 얻었습니다. 우리 학급에 맞는, 선생님 고유의 생각을 담은 학습자료를 만들고 싶으시다면 이 강좌를 추천합니다.",1,1,0,1,0,0,0
724,"긍정의 힘 긍정의 힘을 다시 회복하는 시간이 되었습니다.
수고하신 분들께 감사드립니다.",1,1,0,1,0,0,0
725,"무료지만 유익한 강의 우리 역사에 대해 다시 한 번 생각해보는 시간이 되었습니다.
무료지만 유익했어요.",1,1,0,1,0,0,0
726,"캘리그라피연수 마음을 정리하는 시간으로 좋았어요. 잘하면 취미로 좋을듯합니다.
감사합니다^^",1,1,0,1,0,0,0
727,좋은 수업이었습니다. 코로나로 인해 음악 수업에 활기를 잃었었는데 칼림바라는 악기를 접하게 되어 음악 수업에 즐거움을 찾았습니다. 학생들도 칼림바를 너무 좋아하고 소리도 힐링이 되는 것 같아 매일 듣고 싶네요,1,1,0,1,0,0,0
728,유익한 연수 감사합니다. 수학을 어떠한 관점에서 가르쳐야 하는지 큰 틀을 알게 되었습니다.,1,1,0,1,0,0,0
729,교과와 연계지도 가능한 진로교육! 창의적 체험활동 중에 진로교육은 지도 자료가 충분하지 않아 지도하기 까다로운 창체교육 중 하나입니다. 바로 수업에 적용할 수 있는 실용적인 지도내용을 담아서 정말 좋았고 이 강의를 학기 말에 듣게 되어서 아쉬웠습니다!! 새학기 오기 전에 꼭 들어보시고 연간 계획 잘 세워서 진로교육 하시기 추천합니다^^,1,1,0,1,0,0,0
730,연수 내용이 알차요 5학년 사회 역사수업에 도움이 될 것 같아 수강했습니다. 내용이 알차고 설명을 이해하기 쉽게 잘해주셔서 많은 도움이 되었어요.,1,1,0,1,0,0,0
731,"울 아이들을 이해하기 위한 전문적 미술치료 기법 배우기 매년 물고기화 밖에 그릴 수 없었던 우리반 아리들,,
이젠 다양한 그림과 미술 재료를 통해 아이들도 스트레스를 해소하고
나도 아이들과 소통할 수 있는 좋은 학습법을 터득 했습니다. 감사합니다^^",1,1,0,1,0,0,0
732,"건강을 잃으면 모든것을 읽는다 코로나도, 독감도... 안그래도 연이은 피로감에 요즘들어 한층건강이 안좋아짐을 느끼던 중 이번 연수를 신청하게 되었습니다.
교사들이 잘 걸릴 수 있는 병에 대해 평소 궁금증을 가지고 있었는데 이번 연수를 들으면서 내가 그때 외 그런 증상을 느꼈는지 이해가 되면서 앞으로 어쩌해야할지 해답까지 얻게된 유용한 연수였습니다. 연수 시간도 적당하고 평소 TV에서 보던 강사님들이라 연수 듣기도 한층 수월했습니다. 교사의 직업병이라 할 수 있는 여러가지 질병에 대해 이해하고 앞으로 예방하기 위해 내가 노력할것들에 대해 알고나니 한층 마음이 가볍습니다.
건강을 잃으면 모든 것을 잃는것이다!
퇴직후 교사들이 받는 평균 연금이 10년도 채 안된다고 하더군요. 미리미리 건강에 대해 바로 알고 대비하는 마음자세가 정말 중요하다고 생각됩니다. 그런 의미로 이 연수를 다른 선생님들께 꼭 추천하고 싶습니다! ^^",1,1,0,1,0,0,0
733,"자존감을 높이는 좋은수업입니다. 학생과 선생님의 자존감을 높이는 수업입니다
고정관념을 깨뜨리는
진사람이 먼저 질문하고 이긴사람이 대답하기
특히 스티커를 진사람에게 선물로 주기~
잘 활용하겠습니다.
감사합니다,",1,1,0,1,0,0,0
734,박물관에 관심을 갖게 하는 연수 코로나로 인해 체험학습을 못해서 박물관 관람이 아쉬웠는데 이렇게 연수로나마 박물관을 느낄 수 있어서 좋았습니다. 앞으로 아이들과 만나면서 다양한 지식으로 박물관에 대해 설명할 수 있는 기회를 만들어준 유익한 연수입니다. 많은 선생님께 추천하고 싶은 연수랍니다. 감사합니다.,1,1,0,1,0,0,0
735,좋은 강의였어요 조선의 역사를 객관적으로 훑어볼 수 있어 좋있음.,1,1,0,1,0,0,0
736,사회과 수업할 때 알면 더 잘 가르칠 수 있는 연수! 교사가 아는만큼 교육의 질이 다르다고 생각합니다. 교과서에 단편적으로 등장하는 유물이나 자료를 수박 겉핥기식으로 지도하는 것에 지치셨다면 성호쌤과 함께하는 랜선 박물관 여행을 추천합니다!! 학생들 하교한 뒤 오후에 틈틈히 들었는데 역사적 상식도 늘고 정말 유익했습니다!!,1,1,0,1,0,0,0
737,온작품 읽기 연수를 통해 수업의 깊이가 달라졌어요! 매년 온작품 읽기 수업을 꾸준히 하고 있는데 아이들과 좀 더 즐겁게 할 수 있는 활동에 대한 고민이 많았습니다. 마침 티셀파연수원에서 온작품 읽기에 대한 연수를 찾아서 너무 반가운 마음에 바로 신청하게 되었습니다. 연수를 들으며 아이들과 함께 읽을 수 있는 다양한 작품과 교과의 경계를 넘어 융합수업으로 진행할 수 있는 활동까지 다양한 팁을 제공받게 되어서 너무 행복합니다. 아이들이 생각보다 그림책을 함께 읽는 것을 좋아하고 그 속에 나오는 수학문제나 환경문제 등에 대해 생각하는 것을 좋아합니다. 다양한 사회문제에 대해서도 그림책을 통해 쉽게 접근할 수 있다는 생각이 듭니다. 앞으로도 온작품 읽기 연수에서 추천해주신 책과 활동들을 차분하게 진행하며 학기를 잘 마무리 할 수 있을 것 같습니다. 평소 그림책 활동을 하시는 선생님들께 이 연수를 강추합니다!,1,1,0,1,0,0,0
738,"3학년 교사의 필수 연수 강추!! 꼭 한번 들어야할 필수 연수입니다.

강추입니다.^^",1,1,0,1,0,0,0
739,"의병전쟁에 대하여 많은 것을 알게 되었습니다. 이연수를 통해 의병전쟁에 대하여 많은 것을 알게 된 뜻 깊은 시간이 되었습니다.
강추입니다.!!",1,1,0,1,0,0,0
740,생활에 교직에 꼭 필요한 꿀팁 요즘은 편하게 살려면 정보가 꼭 필요하다. 생활에 교직에 꼭 필요한 연수입니다. 꼭 한번 들어보세요,1,1,0,1,0,0,0
741,"저에게 힐링을 선사한 연수 올한해 새로운 학교에서 새로운 아이들과 함께한다는 생각에 이런저런 고민도 많고 걱정도 많았습니다.
그런 마음으로 한해를 보내던 때에 문득 저에게 들어온 연수... 잘 선택한거 같아요.
힘을 많이 받고 갑니다.
연수준비해주신 선생님 감사합니다^^",1,1,0,1,0,0,0
742,리스닝 훈련 및 문화재 관련 상식을 높여 주는 연수 영어로 우리 문화재에 대해 설명을 들을 수 있는 좋은 기회였습니다. 그런데 시험은 영어 관련이 아니라 역사 시험 같아서 깜짝 놀랐습니다. 강의에 비해 시험이 어려웠어요.,1,1,0,1,0,0,0
743,나를 돌아보는 시간이었습니다. 연수를 통해 아이들의 자존감도 올리고 나를 점검할 수 있는 유익한 시간이었습니다.,1,1,0,1,0,0,0
744,재미있어요~ 우리나라 다양한 문화재들에 대해 영어로 연수를 해주니 잘 이해되고 새로운 사실도 알게되어 유익합니다~,1,1,0,1,0,0,0
745,한번은 듣고 싶었던 연수 재테크와 재무설계에 대한 전반적인 내용을 알고 자신의 현재 상황을 돌아보는 시간이었다.,1,1,0,1,0,0,0
746,"체육시간 준비할 때면 한숨부터 나오는(저만?) 선생님들 주목!! 체육수업 전날 급하게 뭐해야하나 고민하며 인*와 유튜브를 검색하지만 짤막짤막한 활동만 안내되어 있어 알찬 자료를 찾기 너무나 힘들었어요. 이 연수는 건강, 표현, 경쟁, 도전, 각 영역별로 구성되어 있고 수업 전 몸풀기 활동, 본 활동으로 40분 수업을 알차게 구성할 수 있도록 안내가 자세히 되어 있어 무척 도움이 되었답니다!
영상에서 선생님들도 설명을 무척 잘 해주시고 학생들이 실제로 활동하는 모습을 보여주어 주의할 점도 한 눈에 알 수 있었어요. 저처럼 체육수업을 두려워하시는 분들에게는 정말 추천하는 연수입니다!!",1,1,0,1,0,0,0
747,"유용한 과학수업 이야기 아이들과 활동하기에 좋은
직접 활동들이 제시되어 있어 많이 유용합니다.^^
알려준 원리를 바탕으로 융합수업을 운용하도록 하겠습니다.~~",1,1,0,1,0,0,0
748,힐링이 되는 시간이었습니다. 미술 시간에 아이들의 마음을 읽어주고 미술에 대한 거부감을 덜어줄 수 있는 교사와 학생 모두에게 유익한 연수였습니다. 다양한 재료와 활동으로 아이들에게 주제에 따라 미술활동을 하는 이유와 활동을 통해서 다양한 감정을 접하게 해 줄 수 있는 점이 신선했습니다. 활동을 통해 스트레스를 발산하게도 하고 서로의 마음을 읽어주기도 하는 등의 활동을 우리 아이들과 꼭 해 보고 싶습니다. 함께 해 주신 선생님의 솔직하고 명료한 대화도 정말 감사했습니다.,1,1,0,1,0,0,0
749,"효율적 시간 관리에 도움되는연수 학급경영뿐 아니라 효율적 시간관리에 도움되는 연수였어요
구글이 편한점도 있지만 노션만의 장점이 있넹ㆍ",1,1,0,1,0,0,0
750,가정과 학교에서 할 이야기가 많아지게 되었어요 교과서 속이나 tv프로그램 속에서 자주 등장하는 세계문화유산들을 직접 보면서 강의를 들으니 매우 유익했습니다. 학생들에게 상식이 풍부한 교사가 되었고 가정에서는 아이들에게 너무나도 멋진 부모가 되었습니다. 너무 무겁지도 않고 가볍지도 않고 정말 모두에게 필요한 상식의 내용이었습니다. 적극 추천합니다,1,1,0,1,0,0,0
751,"연수후기 도움이 많이 되었습니다.
감사합니다.",0,1,0,1,0,0,0
752,"즐거운 연수 즐겁고 유익한 연수였습니다.
수업에 도움이 많이 되겠습니다.
감사합니다.",1,1,0,1,0,0,0
753,"유익한 연수 유익하고 도움되는 연수였습니다.
감사합니다.",0,1,0,1,0,0,0
754,경제 연수 경제에 대해 다시한번 생각해보며 나의 재테크 현황을 돌아보는 계기가 되었습니다.,1,1,0,1,0,0,0
755,누구나 접할 수 있는 친숙한 악기 수업 칼림바를 알게 된게 최근 코로나 영향으로 집안에서 혼자 즐길수 있는 악기를 검색하면서 접하게 되었는데 막상 혼자 연습하려니 어렵게 느껴졌는데 연수를 들으면서 하나씩 익혀나가는 재미가 있었습니다. 연수를 통해 알게된 연습법으로 열심히 연습해서 수업 또는 동아리 시간에 활용하면 좋을 듯합니다.,1,1,0,1,0,0,0
756,유익한 연수 지금 당장 여행을 갈 수 있지는 않지만 배워두고 알아두면 유용한 여행 영어 표현을 많이 배울 수 있었습니다.,1,1,0,1,0,0,0
757,"기억으로만 끝나지 않는 여행담을 담을 수 있을 듯 합니다. 여행 기록 뿐 아니라 책을 쓰는 전반적인 내용도 담겨 있어 아주 유용합니다. 사진을 어떻게 담고 메모하면 좋은지 좋은 팁을 얻었어요. 삶에 빠질 수 없는 것이 여행인데, 큰 도움이 되는 연수였습니다. 복습 기간도 더 늘려 주시면 좋겠어요. 감사합니다.",1,1,0,1,0,0,0
758,아주 유익한 연수였습니다~ 아주 유익하고 현장에서 활용할 수 있는 좋은 연수였습니다~,1,1,0,1,0,0,0
759,수학교과서 활용 지금까지의 생각과 다른 방법으로 접근하는 수학교수법이 반가웠습니다. 단순하게 생각하고 가르쳤던 것들에 대한 새로운 접근법이 좋았습니다.,1,1,0,1,0,0,0
760,"다양한 분야의 의학정보를 배워서 도움 되는 연수! 각 분야의 전문의가 가르쳐주는 의학 정보라 믿음이 가네요 ㅎㅎ
의학정보를 어렵지 않게 잘 정리해 주어서 이해가 잘 되었습니다!",1,1,0,1,0,0,0
761,"삶의 휴식과 충전을 위한 인문학 지역특색과 지역음식이 무엇인지 생각해 보고 미리 맛보고 상상해 보는 재미가 있고
지친 일상의 삶을 위해 잠시 머리 식히면서 여행 인문학을 즐길 수 있다.",1,1,0,1,0,0,0
762,"이번 여행을 다녀온 후 여행책을 만들겠습니다! 곧 출산을 앞두고 올해 태교여행을 다니고 있습니다.
특별한 주제인만큼 여행에서 찍은 사진들로 나만의 여행책을 만들려고 합니다~ 아이가 크면 이번에 만든 여행책을 보여주며 또 아이와 함께 그 곳을 여행갈 계획을 짜고 싶네요. ^^",1,1,0,1,0,0,0
763,"학생의 자존감을 업 시켜주는 좋은 수업이었습니다. 학생의 자존감을 업 시켜주는 좋은 수업이었습니다.
앞으로도 더 좋은 연수 부탁드립니다.",1,1,0,1,0,0,0
764,요즘 국어 교과에 나온 독서 지도를 위해 유익한 정보 제공 요즘 국어 교과에서 독서지도 내용을 다루고 있는데요. 독서지도시 유익한 정보를 제공하고 있어서 독서 지도시 도움이 많이 될 것 같아요^^,1,1,0,1,0,0,0
765,잘 몰랐던 독립운동가를 말게 되었습니다.. 잘 알려진 독립운동가도 많지만 처음 듣는 독립운동가들도 무수히 많았던 것을 알게되어 감사합니다.,1,1,0,1,0,0,0
766,"건강에 대해 많은걸 생각해보고 느낄수 있었던 시간 알고 있었던 건강상식도 연수를 통해 다시한번 생각해볼수 있었던 시간이었습니다.
제대로 알지 못했던 부분도 있었고 새로 알게 된 건강상식을 알게 되면서 지금부터라도
더욱 건강한 삶을 위해 내 몸 관리를 어떻게 해야하는지 알게된 유익한 시간이었습니다.
감사합니다.",1,1,0,1,0,0,0
767,신규교사에게 추천하고 싶어요~ 학급운영 팁을 많이 얻었습니다~,1,1,0,1,0,0,0
768,재미있어요 유익하고 재미있어요. 주신 책도 잘 볼께요.,1,1,0,1,0,0,0
769,유익한 연수였습니다. 교과에 도움이 되는 유익한 연수였습니다.,1,1,0,1,0,0,0
770,"고학년 담임이라면 꼭 들어야 할 연수 ! 오랜만에 고학년을 담임하게 되어서 걱정이 많았습니다. 우선 세대 차이가 많이 나서 아이들과의 소통이 걱정이었는데, 3월에 미리 이 연수를 들었더라면 더 많이 도움이 되었을 거라는 생각이 드네요. 강사 선생님들의 솔직한 이야기와 학생들에게 활용할 수 있는 적절한 팁을 주셔서 정말 감사합니다.",1,1,0,1,0,0,0
771,활용하기 좋아요 수업시간과 여유시간에 활용하기 좋고 다른 내용으로 응용하기도 좋습니다.,1,1,0,1,0,0,0
772,"고민끝에 결정한 강의 하반기 어떤 연수를 들어야 유익할까 고민을 많이 했습니다.
온라인 연수는 지루하거나 듣기 힘들면 대충 패스할 수 있는 경우가 있기 때문에... 가능하면 귀담아 들을 수 있고, 관심도가 높은 연수를 선택하려고 했어요.
건강과 관련된 이 연수는 전문의가 나와서 비전문가도 쉽게, 그리고 정확하고 안전한 건강정보를 얻을 수 있겠다 싶어서 선택하게 되었지요.
연수 후기도 좋아서~ 바로 선택해서 듣게 됐습니다.

정말 듣기 쉽고~ 쉽게 우리가 고민하던 질병들에 대해서 잘못 알고 있었던 부분을 수정할 수 있었습니다. 새롭게 알게된 내용들도 있었구요. 지루하지 않고. 귀에 쏙쏙 잘 담을 수 있어서 편하게 잘 들었네요.

마지막까지 집중해서 들을 수 있었던 손꼽던 연수였습니다 ㅎㅎ

이 분야의 다른 연수들도 많이 열렸으면 좋겠습니다 ^^",1,1,0,1,0,0,0
773,"선생님 강의가 너무 훌륭해요 현직 선생님께서 어쩜 이렇게 훌륭하게 연수를 해 주시는지 정말 감탄했습니다!
제가 시간이 없어서 참여가 부족했지만 틈틈히 봐야겠습니다.
수고 많으셨어요!!!",1,1,0,1,0,0,0
774,좋은 연수입니다 사회교과 활동에 대해 알게되었습니다~,1,1,0,1,0,0,0
775,과학과 기술을 알아가는 만들기 단순한 만들기 실험이 아닌 과학과 기술의 원리를 알아가고 예술적인 모습가지도 생각해볼 수 있는 시간이었습니다.,1,1,0,1,0,0,0
776,손쉽게 가지고 다니는 악기 간단하게 가지고 다니며 연주 할 수 있는 악기 칼림바에 대하여 배우는 시간이었습니다.,1,1,0,1,0,0,0
777,사용할 수 있는 영어 SNS에서 실제로 사용할 수 있는 다양한 표현들을 배웠습니다.,1,1,0,1,0,0,0
778,"정말 친절하게 잘 가르쳐주시네요 연수제목처럼 온라인 수업활동에 필요한 내용들을 너무 친절하게 잘 알려주십니다.
제가 너무 바쁜 달에 신청해서 잘 참여못해 아쉽지만 좀 한가해지면 다시 들어야겠어요!
선생님! 너무 훌륭하십니다!!!",1,1,0,1,0,0,0
779,유익한 연수 생활 속에서 건강을 관리하는 데 도움이 되는 연수라 생각됩니다.,1,1,0,1,0,0,0
780,"5학년 사회교과를 위한 필수 연수입니다. 5학년 2학기, 한 권 가득, 온통 갑자기 역사가 주인공인 시간들,

학생들의 수준차가 이토록 큰 시간이 있을까요?
책, 체험으로 지식 가득한 학생들, 반면 역사는 역사일 뿐, 나의 삶과 관계없는, 과거이야기!
양면의 극단을 달리는 수업시간, 교사로서 어떤 수업을 설계해야 할지 더욱 고민되는 시간들!

게다가 이것저것 자료도 많고, 활용하고 싶은 것도 많지만, 한정된 시간에 최적의 수업을 설계하고 싶은 것이 교사로서의, 저의 로망이었습니다.

역사 수업의 포인트, 전개와 활용에 대한 참 괜찮은 모델을 수집할 수 있었던 기회가 된 연수!

강추합니다.",1,1,0,1,0,0,0
781,미술활동을 통해 감정에 대한 생각을 하게됩니다. 미술활동을 통해 감정에 대한 생각을 하게됩니다.,1,1,0,1,0,0,0
